participant_id,role,response
P01,App Reviewer,"The app is fast and easy to use. I finished setup in under two minutes."
P02,App Reviewer,"I like the clean interface, but the text is small on my phone and hard to read."
P03,App Reviewer,"Great idea overall, though I had trouble finding the settings menu at first."
P04,App Reviewer,"Notifications arrive late sometimes, but everything else works smoothly in daily use."
P05,App Reviewer,"I use this app every morning. The reminders keep me on track and focused."
P06,App Reviewer,"The recent update improved performance, but one button still overlaps on smaller screens."
P07,App Reviewer,"I appreciate the simple onboarding flow. It explained features without being overwhelming."
P08,App Reviewer,"The search feature is useful, but results could be sorted better by relevance."
P09,App Reviewer,"I experienced one crash this week when uploading an image from my gallery."
P10,App Reviewer,"Sync between devices works well. My notes appear instantly on tablet and laptop."
P11,App Reviewer,"The color contrast is better now, which makes reading at night much easier."
P12,App Reviewer,"I wish there were more customization options for dashboard widgets and layout preferences."
P13,App Reviewer,"Overall very reliable app. I have not lost any data since I started."
P14,App Reviewer,"The tutorial is short and clear. I understood the core workflow quickly."
P15,App Reviewer,"Some icons are not intuitive. I had to tap around to learn them."
P16,App Reviewer,"The app helps me plan tasks, but recurring events should be easier to edit."
P17,App Reviewer,"Loading times are excellent. Even large files open quickly compared with similar apps."
P18,App Reviewer,"I enjoy the minimal design, though I would like a stronger dark mode."
P19,App Reviewer,"The export feature saved me a lot of time before our team meeting."
P20,App Reviewer,"I found a typo in the profile section, but functionality is still solid."
P21,App Reviewer,"After using it for a month, I trust the app for daily planning."
P22,App Reviewer,"Please add keyboard shortcuts on desktop. That would improve speed for power users."
P23,App Reviewer,"The calendar integration was simple to enable and worked on the first try."
P24,App Reviewer,"I like the progress tracking charts, but labels on the axis are cramped."
P25,App Reviewer,"Support replied quickly to my question and solved the issue within one day."
P26,App Reviewer,"The app feels polished, and interactions are smooth across every screen I tested."
P27,App Reviewer,"I had difficulty resetting my password because the email arrived in spam."
P28,App Reviewer,"Feature discovery is good, but advanced options should include clearer descriptions and examples."
P29,App Reviewer,"Battery usage seems reasonable even when background sync is turned on all day."
P30,App Reviewer,"The app is helpful for team collaboration, especially the shared comments feature."
P31,App Reviewer,"I can complete common tasks quickly, which makes this app part of my routine."
P32,App Reviewer,"Please improve offline mode because some actions fail when internet coverage is weak."
P33,App Reviewer,"I appreciate that my data is backed up automatically without extra setup."
P34,App Reviewer,"The filter options are flexible, but the panel should remember my last choices."
P35,App Reviewer,"This is one of the few apps my parents can use without help."
P36,App Reviewer,"The first screen has too much text. A cleaner layout would reduce confusion."
P37,App Reviewer,"I noticed better stability after the latest release and fewer freezes overall."
P38,App Reviewer,"The app does exactly what I need, and it does not feel bloated."
P39,App Reviewer,"I would like an option to pin favorite items for faster access."
P40,App Reviewer,"Data visualization is helpful, but tooltips should explain metrics in plain language."
P41,App Reviewer,"The sign in flow is secure and straightforward, which gave me confidence."
P42,App Reviewer,"Sometimes animations feel slow, though they do make the interface look modern."
P43,App Reviewer,"I enjoy using this app during commutes because it is simple and responsive."
P44,App Reviewer,"Please allow bulk actions for deleting items, since doing it one by one is tedious."
P45,App Reviewer,"The app has a friendly tone and clear writing throughout most screens."
P46,App Reviewer,"I switched from another app and migration was easy with the import tool."
P47,App Reviewer,"Error messages are clearer now, and I can fix problems without guessing."
P48,App Reviewer,"The app occasionally logs me out, but reauthentication is fast and painless."
P49,App Reviewer,"I recommend this app to classmates because it saves time every week."
P50,App Reviewer,"Great experience overall. A few accessibility improvements would make it even better."
